numeroExpediente,fechaHoraSancion,fechaComunicacion,ente,numeroNotificaciones,vehiculo,conductor,infraccion,importe,gestionada,empresa,completada,perdidaPuntos,comentarios
EXP506550,2024-06-26 01:26:21,2025-11-18,Solera-Huerta,2,1144BDQ,Eligia Carmona-Farré,Explicabo praesentium voluptates molestiae cupiditate eveniet.,100.18,True,Dávila-Rodríguez,False,True,Eos esse minus corrupti eius ducimus.
EXP643422,2025-01-24 01:03:17,2025-10-29,"Nadal, Mateos and Ballester",0,0315GCN,Wálter Zurita Leon,Suscipit quia vitae distinctio explicabo placeat nulla minima.,882.95,True,Capdevila-Pardo,False,False,Minus provident deserunt.
EXP789779,2024-09-12 13:00:52,2026-01-27,"Acuña, Plana and Alegre",4,1563TKO,Cruz del Cerezo,Omnis placeat doloremque a sunt dolorem.,332.75,True,"Redondo, Andrés and Arnal",False,False,Delectus non ipsum veritatis delectus.
EXP062462,2025-03-13 09:52:23,2025-11-24,Casanova-Chaves,1,4772SDU,Concha Carmen Pino Ibáñez,Magnam similique rerum dignissimos expedita officia nostrum.,324.33,True,Ruano and Sons,True,False,Ex explicabo non hic itaque.
EXP886532,2024-09-01 07:54:44,2026-03-27,Escolano-Díaz,5,1144BDQ,Jacobo Cortés Esteban,Sapiente voluptate magni.,386.58,False,"Maza, Duarte and Ríos",False,True,Ullam asperiores sequi.
EXP989554,2024-08-19 07:17:05,2025-09-05,"Garzón, Porras and Cánovas",3,5388BHA,Isaura Tomás Gomez,Voluptate ea ipsam velit.,351.78,False,"Mesa, Zamora and Arévalo",True,True,Dolores dolorem eaque.
EXP398275,2024-10-09 02:21:57,2025-05-05,"Terrón, Andres and Tur",5,5388BHA,Victor Evaristo Ríos Verdú,Laborum quaerat animi aspernatur assumenda tenetur.,405.14,False,Díaz-Castillo,True,False,Optio perspiciatis repellat labore exercitationem facere.
EXP655195,2025-01-24 01:52:54,2025-08-21,Miguel and Sons,0,2172SLG,Fernando Rebollo Ripoll,Placeat facere reprehenderit minus.,459.2,False,"Madrid, Atienza and Román",False,False,Necessitatibus dolorem ipsum facere accusantium.
EXP255642,2025-01-03 23:17:20,2025-04-13,Ferrera PLC,5,5304PTF,Albert Perea Checa,Praesentium exercitationem ab consectetur quia.,826.04,True,"Campo, Diego and Villalba",False,True,Ipsum accusantium nulla quibusdam.
EXP271714,2024-10-02 08:29:43,2026-03-09,Baena Inc,4,0944CHH,Tomás Sanabria Castilla,In id dolorem ullam illo architecto laborum.,732.38,False,Verdú-Llorens,False,True,Culpa nostrum iste pariatur magnam.
EXP928611,2024-12-18 06:38:38,2025-11-08,Ferrando PLC,4,1534AOZ,Begoña Elisabet Luna Durán,Dolorem eos rem accusantium inventore illo eveniet.,122.05,True,Narváez-Pintor,True,True,Molestiae quisquam est.
EXP488739,2024-05-21 13:53:47,2025-05-20,"Nicolás, Zurita and Beltrán",2,8239JGK,Josep Arjona Noriega,Aut veritatis quod dolorum ratione.,501.45,False,Becerra-Jordá,False,True,Repudiandae modi adipisci aspernatur maiores.
EXP570710,2024-08-04 00:27:24,2026-03-06,Benitez Ltd,2,2765SLL,Camila Angelina Rubio Poza,Id ratione hic deleniti ipsam expedita cum.,912.86,False,Granados and Sons,False,True,Hic recusandae laudantium non.
EXP745268,2024-10-18 00:11:58,2025-10-14,"Valencia, Borrego and Montero",5,2140CAX,Pascuala Barberá Aller,Nemo eveniet blanditiis ex enim quibusdam dignissimos.,159.49,False,Álvaro-Morera,True,False,Natus aspernatur cum aut aut accusantium.
EXP875369,2025-01-10 16:48:07,2025-11-11,"Carbonell, Nebot and Hierro",4,2172SLG,Josep Arjona Noriega,Est quam occaecati.,357.9,True,"Romero, Frutos and Rosa",False,False,Officiis nostrum et iure.
EXP854163,2025-01-02 04:03:00,2025-12-03,"Machado, Poza and Gisbert",4,4319ZSD,Valero Céspedes Francisco,Impedit nulla ut non itaque quis a aspernatur.,182.69,False,Rovira LLC,True,True,Molestiae aliquam harum distinctio.
EXP767557,2025-03-30 00:38:34,2025-05-27,Villanueva PLC,0,7439RDO,Ale Maza,Voluptate at doloribus accusantium eum.,452.51,True,González and Sons,True,False,Deserunt doloribus accusantium suscipit.
EXP749188,2024-07-22 10:08:38,2025-04-10,"Lobato, Toro and Montserrat",2,3000MDM,Tamara Duque Tamarit,Minima sint atque quae qui vitae unde.,69.99,False,Abellán-Gargallo,False,False,Perspiciatis et iusto nam.
EXP326124,2025-03-22 21:29:47,2025-10-27,"Tello, Lledó and Guijarro",2,7142IUS,Fernando Rebollo Ripoll,Deserunt doloribus reprehenderit assumenda fuga.,370.79,False,"Plana, Bernad and Cuéllar",False,False,Sapiente veniam odio nisi.
EXP250493,2024-09-22 14:56:11,2025-08-26,"Bayo, Pedraza and Tomé",4,9150GOL,Carmina Plaza Márquez,Quod laboriosam itaque doloremque vitae tempore itaque magnam.,995.14,True,Canals-Luz,False,True,Quasi sapiente a iure.
EXP529874,2025-01-05 02:48:13,2025-08-05,"Santamaria, Roselló and Puga",0,2765SLL,Concha Carmen Pino Ibáñez,Tempora iusto quos occaecati.,509.03,True,Viana Ltd,True,True,Ipsum aut aspernatur.
EXP632336,2024-11-11 22:29:27,2026-01-08,Tejada Ltd,2,9470NUR,Raquel Emelina Morcillo Sala,Veniam in accusantium asperiores reiciendis.,679.33,True,"Rius, Juárez and Asensio",False,True,Voluptate totam ullam beatae.
EXP831838,2025-01-28 13:49:15,2025-09-11,"Nicolau, Beltrán and Ibañez",3,3561WHH,Concha Blanco Ureña,Deserunt inventore iure natus aliquid dolore.,159.89,False,"Boix, Bravo and Sacristán",True,False,Illo quidem ad.
EXP323491,2024-10-31 12:24:39,2026-03-06,Larrañaga-Pacheco,5,0375IAP,Celestino Rosell Manso,Architecto exercitationem quisquam harum aliquam quaerat quam.,661.52,False,"Flor, Ledesma and Llobet",True,True,Pariatur eius dolorem commodi minus.
EXP904818,2025-01-05 17:10:53,2025-07-22,Gallego Inc,2,6264NRV,Nacho Girón,Doloribus possimus maiores aut.,65.67,True,"Portero, Molina and Pavón",True,True,Voluptatibus aut cum magni quo dolorem.
EXP879826,2025-02-19 00:58:18,2025-11-10,Peñalver-Teruel,1,0218GJV,Concha Carmen Pino Ibáñez,Alias optio dignissimos quibusdam voluptatem delectus aperiam porro.,613.23,False,"Salvador, Llopis and Montaña",False,False,Laborum commodi eveniet maiores voluptatibus.
EXP717975,2024-06-30 00:35:27,2025-06-19,Blasco LLC,1,1647CPN,Isaura Tomás Gomez,Vitae natus animi esse doloremque eos sit.,155.7,True,"Flor, Quero and Valera",True,True,Inventore quos eum tempora odio.
EXP550548,2024-12-06 00:48:02,2025-12-15,"Belda, Cerdá and Jiménez",4,9470NUR,Adoración Barreda Durán,Accusantium quos rerum omnis doloremque suscipit.,887.16,True,"Román, Peiró and Blanco",True,False,Repellendus hic est debitis incidunt beatae.
EXP120539,2024-09-26 15:47:52,2026-03-16,"Sevillano, Taboada and Acuña",3,0494XJP,Humberto Cortés Giner,Possimus animi veniam ut non inventore magni illum.,223.43,True,Villegas-Casal,False,True,Amet exercitationem iusto tenetur eius.
EXP982388,2024-11-11 14:34:06,2026-02-07,Pons-Vargas,0,4912WXT,Guillermo Lasa Echevarría,Reiciendis quis fugiat aspernatur libero voluptate sapiente ullam.,841.37,True,"Perez, Rozas and Tejedor",False,True,Sed debitis deserunt veniam quis totam.
EXP776135,2024-07-23 00:26:37,2025-06-21,"Batlle, Abad and Luís",5,4380JCZ,Nilda Mateo,Neque exercitationem voluptatem laudantium quisquam.,132.15,True,"Guzmán, Campoy and Luís",True,False,Corporis quaerat aliquam aut.
EXP558985,2024-07-26 05:40:00,2026-01-01,Luís LLC,4,5778VHR,Lisandro Zamora-Mínguez,Corrupti sapiente fuga aperiam occaecati.,717.01,True,"Morcillo, Luz and Peral",True,False,Fugiat debitis molestias eos consequatur minus.
EXP966906,2024-05-03 19:09:20,2025-04-09,Albero PLC,3,7456RIT,Concha Blanco Ureña,Magni vero dignissimos at.,370.52,False,"Tejedor, Portillo and Aparicio",False,False,At eum aliquid.
EXP705666,2025-02-10 22:13:00,2026-01-29,"Rios, Molins and Gimeno",5,7683KUZ,Cintia Catalá Campillo,Officia fugiat officia.,572.99,True,Jordán-Egea,False,True,Doloremque reprehenderit quos.
EXP427861,2024-09-04 12:38:28,2025-12-24,Carrillo LLC,4,1584RKH,Ale Maza,Officia eum maxime dolorem fuga deserunt.,667.92,False,"Barrena, Santamaría and Alegre",True,False,Totam harum eius ullam deleniti repellendus.
EXP569385,2025-03-15 05:22:12,2025-11-04,Torre Group,0,0375IAP,Ricarda Carvajal,Hic voluptates nemo excepturi dignissimos recusandae magnam culpa.,826.89,False,Carrera-Casanovas,True,False,Distinctio vel placeat.
EXP186743,2024-11-01 07:06:54,2026-02-01,Ayuso Inc,0,9049GCB,Octavia Ramirez Sedano,Esse voluptatibus adipisci nobis.,220.69,False,"Falcón, Chamorro and Naranjo",False,True,Fuga aliquid iure eum rem.
EXP892215,2024-11-07 01:30:31,2025-06-07,"Arrieta, Blanes and Albero",5,3285OCV,Ricarda Carvajal,Inventore deleniti fugit dolorem.,338.22,False,Palmer-Giménez,False,False,Placeat aperiam veniam.
EXP104208,2024-06-23 21:14:38,2026-01-21,Gaya Group,0,0431SBO,Valero Céspedes Francisco,Reiciendis quibusdam ad.,354.43,True,"Rovira, Borja and Laguna",True,True,Officiis aut molestias natus tenetur.
EXP961388,2024-06-23 06:07:46,2025-08-16,Lucena PLC,2,4052EAZ,Priscila Luz Navarro,Eligendi veniam ipsa omnis sapiente recusandae ea.,796.35,False,Santos-Cañizares,True,False,Tempore dolor nemo.
EXP255272,2024-05-13 17:26:20,2025-08-28,Guzman-Manso,0,5388BHA,Eulalia Montalbán-Iñiguez,Quidem amet iste iste ea.,129.93,True,Leal PLC,False,False,Mollitia pariatur possimus ipsam.
EXP614831,2024-04-18 15:28:32,2026-02-18,"Cañete, Rosselló and Melero",3,0708UDK,Cintia Catalá Campillo,Voluptatibus doloribus animi fugit illo veniam.,734.49,False,"Toro, Fajardo and Miralles",True,False,Similique quo laborum magnam aliquid.
EXP897997,2024-10-14 04:00:34,2025-12-16,Ferrán-Sanz,2,8509RRW,Milagros Cózar,Aliquam temporibus soluta quas.,824.29,True,Agullo-Amorós,False,True,A eligendi dolorum optio.
EXP109358,2024-11-30 19:26:18,2025-11-15,Lorenzo-Castilla,3,8095GCT,Borja Calvet Acuña,Illum reiciendis magnam deserunt.,986.17,True,"Ortiz, Lamas and Carballo",False,False,Aspernatur corrupti porro placeat magnam.
EXP078878,2024-09-04 21:24:48,2026-01-13,Caro-Gaya,0,9026CZX,Dionisia Castelló,Perferendis quaerat perferendis laborum.,243.23,False,"Reina, Ibáñez and Ferrer",False,False,Cum neque ducimus nihil ipsum culpa.
EXP609016,2024-11-10 12:45:32,2026-03-06,Barberá-Boada,0,7142IUS,Priscila Luz Navarro,Dolore doloribus assumenda atque dolorem numquam maiores.,682.25,True,"Toledo, Solano and Viñas",True,True,Iste suscipit soluta ad ducimus.
EXP596773,2025-03-17 14:23:35,2025-06-14,"Coronado, Gallego and Baena",3,1563TKO,Alexandra Andreu Ramón,Totam explicabo asperiores earum inventore.,215.76,False,Narváez-Gil,True,False,Aut molestias maxime optio minus fuga.
EXP193228,2024-06-02 22:00:52,2026-02-24,Alcaraz PLC,4,0111BBU,Duilio Checa-Ibañez,Odio sint odit dolorum quo.,160.29,True,Lledó Group,True,False,Recusandae provident maxime.
EXP588079,2025-03-09 19:19:24,2025-07-01,"Fajardo, Saez and Carranza",5,9470NUR,Paloma Lucena Méndez,Aperiam doloremque rerum itaque vero hic.,555.91,False,Tello-Rubio,True,True,Cum quibusdam velit voluptatibus similique ducimus.
EXP060153,2024-11-22 13:25:46,2025-06-28,Morales-Valera,0,6143UNS,Humberto Cortés Giner,Sed eligendi itaque sequi facere repudiandae.,936.97,False,"Martinez, Vilanova and Galán",False,False,Error deleniti aspernatur.
EXP820887,2025-01-20 14:57:54,2025-05-16,Cabeza-Fuentes,3,7683KUZ,Jonatan Bruno Piñeiro Cantero,Possimus maiores facere voluptatibus atque.,727.19,False,"Lledó, Aparicio and Lozano",False,True,Fugit voluptatum eos non.
EXP151067,2024-09-09 19:15:40,2025-05-09,Mateu-Parejo,4,8510PLZ,Eladio Sala Angulo,Velit maxime veritatis dolores nihil.,459.4,True,Barriga LLC,True,True,Debitis laborum porro culpa.
EXP418279,2025-01-07 23:29:57,2026-02-25,Berenguer-Castejón,1,4912WXT,Concha Blanco Ureña,Eos at cum occaecati beatae minima.,121.68,True,Cobo Group,True,False,Fugiat harum praesentium quas iusto.
EXP579027,2025-03-14 23:46:54,2025-11-11,"Arnau, Solé and Otero",5,4319ZSD,Charo Blanes,Adipisci dolores vel est dolore.,365.77,True,Fabra-Marqués,True,True,Quisquam occaecati voluptas porro hic.
EXP343222,2024-04-09 20:19:05,2025-06-30,Barros PLC,4,3779AAP,Pascuala Barberá Aller,Porro sunt itaque.,523.73,False,Valentín Group,False,True,Eaque laborum ratione minus natus adipisci.
EXP257079,2024-05-14 03:46:26,2025-10-21,"Cid, Olivares and Sierra",2,0578RXU,Alexandra Andreu Ramón,Harum atque alias accusamus in at.,190.86,False,"Prada, Sanabria and Crespo",False,True,Corrupti inventore reiciendis dolorem delectus odit.
EXP909784,2025-03-14 06:22:49,2025-11-22,"Sanjuan, Calzada and Bustamante",4,6539ZPQ,Abigaíl Piedad Mur Borrego,Quo ea totam accusantium atque exercitationem.,799.53,True,"Campo, Cánovas and Toro",True,False,Mollitia ut tempore fugiat exercitationem natus.
EXP839586,2024-09-22 09:48:15,2025-06-23,Amorós-Palomo,5,3721GYW,Inmaculada Huertas Alfonso,Quam unde necessitatibus quos.,293.1,True,Zapata-Bosch,True,False,Praesentium blanditiis architecto.
EXP268773,2024-04-21 03:01:53,2025-07-27,"Escalona, Gil and Quero",4,0148YAF,Fortunata Abril-Ferrándiz,Earum quod beatae provident fugit exercitationem nostrum nihil.,455.75,True,Torres LLC,True,False,Dolorem tenetur provident numquam porro odit.
EXP875842,2024-12-28 19:22:37,2026-03-26,Solé and Sons,1,9321ETT,Cebrián Sosimo Valdés Campos,Fuga tempora officiis tenetur nisi.,621.92,True,Carrión-López,False,False,Fuga molestiae ratione optio.
EXP432476,2024-05-24 12:18:09,2025-09-03,"Casanovas, Barral and Román",3,7445EIA,Nilda Mateo,Nobis ratione nulla pariatur dolorum.,929.8,True,Acevedo-Echevarría,False,False,Ipsum sed aperiam magni.
EXP992853,2024-06-29 13:23:45,2025-08-31,Pacheco PLC,2,5388BHA,Rodrigo Mosquera Cadenas,Quaerat architecto dolore.,65.0,True,"Llamas, Montesinos and Palacio",False,True,Minus nulla magni iure.
EXP771768,2024-05-06 15:35:35,2025-11-20,Garcés-Carlos,3,8797RET,Francisca Sotelo-Sevilla,Ullam rem fuga recusandae necessitatibus voluptate officia.,512.76,True,Coello-Mur,True,True,Accusantium nulla hic minus dolor.
EXP366603,2024-04-30 12:05:36,2026-03-26,"Vilanova, Novoa and Flor",1,7052ZPC,Ramiro Clavero Izaguirre,Repudiandae delectus esse eum molestiae ut.,986.86,False,Barriga-Cruz,False,False,Quod iure optio neque nisi illo.
EXP957998,2025-04-03 03:26:35,2025-09-30,Vila-Izaguirre,3,5405PVE,Inmaculada Huertas Alfonso,Iure quis quos eum iusto tenetur maxime nulla.,206.26,False,Manzanares and Sons,True,False,Nobis nihil architecto.
EXP243709,2025-03-17 09:50:59,2026-03-14,"Plaza, Gibert and Mayoral",4,7749OBW,Fortunata Abril-Ferrándiz,Dicta odit corporis.,123.9,True,"Ropero, Ramis and Cobos",True,True,Mollitia ipsam dolores.
EXP370087,2025-04-08 04:03:44,2025-05-16,Font LLC,1,4826TDD,Charo de Cortés,Aperiam blanditiis dolorum nihil.,573.91,False,Mayol-Teruel,True,True,Asperiores sapiente est.
EXP544523,2024-11-01 09:48:10,2026-03-10,Echevarría Inc,5,8190AOD,Jacobo Cortés Esteban,Quos illo iusto.,783.81,True,Ojeda-Losa,True,False,Hic voluptatem in nesciunt possimus.
EXP133904,2024-10-24 12:07:32,2025-08-17,Antón-Barba,0,0890DXN,Charo Blanes,Eaque delectus libero quo voluptas architecto laboriosam.,642.05,False,Montes LLC,True,True,Molestias ullam voluptas sequi.
EXP621923,2024-05-16 03:56:59,2025-04-22,"Arribas, Niño and Cerezo",2,0148YAF,Ciríaco Benigno Catalán Mesa,Corporis blanditiis deleniti quisquam.,762.03,False,Infante Ltd,True,False,Aspernatur modi non nulla accusantium aperiam.
EXP970848,2024-08-02 10:42:15,2025-08-28,Padilla-Cabrera,1,8510PLZ,Raquel Emelina Morcillo Sala,Assumenda illum numquam occaecati.,487.26,True,Romeu-Moll,False,True,Officia doloremque animi placeat fugit.
EXP612827,2024-10-05 20:13:38,2026-03-14,"Calatayud, Fuente and Buendía",0,0735DKC,Cintia Catalá Campillo,Blanditiis atque necessitatibus id enim iusto praesentium.,466.05,False,"Colom, Fuertes and Ramis",True,True,Quisquam iste quaerat.
EXP169059,2025-02-26 15:06:54,2025-08-28,Taboada Ltd,5,9049GCB,Adelaida Chus Fuentes Escudero,Corrupti molestias corrupti.,727.73,True,Peral and Sons,False,False,Fugiat et id.
EXP223863,2024-04-08 21:03:06,2025-06-28,Tur-Aguilar,1,0890DXN,Cebrián Sosimo Valdés Campos,Dolor ducimus explicabo adipisci.,452.66,False,Echevarría Group,True,True,Eos eaque aperiam iste.
EXP437692,2024-12-17 08:54:11,2025-08-12,"Larrañaga, Cantón and Uría",1,5778VHR,Victorino Velasco-Domingo,Dolore nihil est eos explicabo excepturi cum.,788.4,False,Carlos-Luna,False,True,Fuga repellat voluptatibus aut.
EXP848974,2024-10-28 22:07:55,2025-05-08,Azorin-Caballero,3,2040LHJ,Nélida Montero,Neque harum perferendis blanditiis optio saepe ipsa soluta.,454.33,True,Uría Group,False,True,Placeat architecto necessitatibus veritatis amet ex.
EXP323474,2024-09-12 17:47:34,2025-06-17,Menéndez PLC,2,9150GOL,María Teresa del Páez,Corrupti incidunt porro maiores.,971.28,False,"Aparicio, Palomar and Pons",True,False,Labore iure ducimus ipsa blanditiis.
EXP002295,2024-07-11 11:04:26,2026-02-18,Coronado Ltd,5,3122NBN,Ágata Farré,Facilis maxime occaecati voluptas commodi necessitatibus.,998.51,False,Ariño Ltd,True,True,Totam culpa voluptate deleniti dolorum ut.
EXP340830,2024-08-07 07:01:52,2025-12-13,Morán-Valle,4,0963QJT,Alcides Villalba Peña,Sint impedit esse non laudantium.,779.22,False,"Alarcón, Arellano and Sarmiento",False,False,Voluptatibus eos perferendis.
EXP728340,2024-09-21 09:48:12,2026-03-25,Agustí-Solana,4,1584RKH,Rodrigo Mosquera Cadenas,Voluptatem magni iusto eaque quidem consequuntur.,464.67,False,Elorza PLC,True,False,Doloremque molestias nesciunt aliquam.
EXP685613,2024-06-19 07:40:36,2026-03-10,"Elías, Múñiz and Cazorla",2,6210XYM,Serafina Falcó Dueñas,Officiis nisi cum quas culpa eaque.,882.86,True,Arnal PLC,True,True,Dolorem laudantium quidem voluptatem nam recusandae.
EXP383685,2024-04-09 01:02:48,2025-06-01,Rebollo-Pulido,3,3000MDM,Eligia Carmona-Farré,Quasi itaque illum sint nemo laboriosam.,153.71,True,Tormo Ltd,True,True,Qui quisquam laborum quisquam.
EXP337480,2025-01-10 10:52:49,2025-04-29,Parejo LLC,0,4999FWG,Serafina Falcó Dueñas,Maiores perferendis error officia assumenda occaecati nobis.,664.2,False,"Agustín, Puente and Puerta",True,False,Nihil voluptates delectus ratione at tempora.
EXP961257,2024-10-02 03:52:11,2025-08-06,Cervera LLC,2,3285OCV,Nilda Mateo,Necessitatibus voluptas nemo eligendi repellendus amet.,755.96,False,Acero-Carrión,True,False,Tempore commodi voluptatum sequi amet voluptatem.
EXP251534,2024-09-13 19:46:33,2026-01-24,"Peralta, Huguet and Macías",1,9551VIQ,Delfina Flor Pol,Eligendi doloribus esse tempore qui.,354.74,False,"Priego, Medina and Elorza",False,False,Optio fuga suscipit sit corporis omnis.
EXP366344,2024-05-01 11:42:30,2026-01-27,"Carretero, Segarra and Gomez",2,0174JDU,Begoña Elisabet Luna Durán,Cumque ratione quaerat eligendi aspernatur quasi.,838.03,True,"Alegre, Castelló and Arellano",False,False,Vero culpa quae.
EXP205607,2025-03-05 02:39:35,2025-12-11,"Verdugo, Baños and Matas",2,2598RAI,Silvia Revilla Barrena,Molestias nostrum labore aliquid recusandae architecto sunt.,668.62,True,Aramburu-Perea,True,False,Necessitatibus ducimus itaque cum error praesentium.
EXP232217,2024-04-20 06:31:59,2025-11-28,"Vaquero, Bermejo and Antúnez",3,8709WMZ,Andrés Iñiguez-Navarro,Inventore blanditiis aspernatur veritatis distinctio corrupti dolorem.,757.48,True,Donaire LLC,True,True,Tenetur a sunt quia sapiente.
EXP418847,2025-03-02 08:30:41,2026-03-05,Campoy-Muro,0,8132QXE,Celestino Tello Ruiz,Excepturi rem quam ipsum accusamus.,199.15,False,Albero-Amores,True,True,Exercitationem accusamus tenetur.
EXP588197,2025-04-04 08:56:37,2026-03-20,"Quintana, Fuster and Montes",0,7683KUZ,Nélida Montero,Quis consectetur ea ipsam iure doloribus iusto cum.,682.55,False,Ballester-Escobar,True,False,Debitis itaque enim occaecati accusamus quis.
EXP810131,2024-07-01 08:43:00,2025-07-12,Baños-Estrada,4,3285OCV,Manuel Villalonga Téllez,Maxime nulla molestiae ratione ullam perspiciatis qui.,449.86,True,Osorio and Sons,False,False,Voluptatum optio temporibus quis consequuntur neque.
EXP738248,2024-12-29 21:38:12,2025-07-19,Losada-Águila,2,9026CZX,Rodolfo Francisco Javier Solé Paredes,A consequatur non harum earum.,883.92,True,Romero and Sons,True,False,Modi nihil cum.
EXP107838,2025-01-26 00:27:45,2025-06-04,"Ríos, Duran and Ariza",1,4826TDD,Jonatan Bruno Piñeiro Cantero,Unde quo quod doloribus tempore.,706.23,False,Terrón PLC,False,False,Autem accusamus expedita.
EXP203799,2024-08-21 00:35:21,2025-08-02,Folch Inc,0,6539ZPQ,Josep Arjona Noriega,Corporis adipisci modi illo voluptates praesentium.,225.9,True,"Verdugo, Barrios and Gibert",False,False,Iure itaque voluptatum aliquam iste exercitationem.
EXP025780,2024-04-20 22:09:38,2025-04-10,Puga-Pareja,2,3122NBN,Adoración Barreda Durán,Similique commodi quidem quidem.,886.3,False,Castillo Inc,False,False,Labore fugit ipsam reiciendis magnam.
EXP034466,2024-11-27 22:22:15,2025-06-09,Enríquez LLC,3,1005BVC,Edgardo Castro Calleja,A culpa ea nostrum voluptas laudantium sequi illo.,685.21,False,Barceló-Chico,False,False,Rem a rerum delectus itaque.
EXP961954,2024-10-16 11:30:40,2025-05-07,Nuñez-Cabanillas,4,0963QJT,Eligia Carmona-Farré,Aliquid mollitia odit iure ut quos.,186.34,False,Arranz and Sons,False,False,Facilis culpa enim.
EXP311506,2024-05-07 02:35:45,2025-12-27,Aliaga-Ayllón,3,7445EIA,Emiliana de Poza,Commodi vero a totam rerum voluptatum recusandae.,585.4,False,Hoz-Palomino,False,False,Enim perferendis deserunt iste error.
EXP008001,2024-10-23 15:30:54,2025-09-28,Barreda Group,5,9960CVJ,Valero Céspedes Francisco,Nemo explicabo voluptatem dolore dolorum nihil perferendis.,119.07,True,Pineda-Cuadrado,True,True,Recusandae exercitationem minus reprehenderit.
EXP807703,2024-08-23 03:34:18,2025-06-05,"Ángel, Santamaría and Fuertes",2,1855MVQ,Concha Carmen Pino Ibáñez,Aperiam rerum est asperiores dolores ab voluptatibus repudiandae.,865.73,False,Salgado and Sons,False,False,Perferendis molestiae illum consequatur sapiente deleniti.
